{
  "schema_version": 1,
  "catalog_name": "TRACE Image Capability Registry",
  "catalog_description": "Provider-neutral abstract VM images aligned with OpenStack Image Guide (obtain-images) plus TRACE lab extensions. Not Glance artifacts.",
  "images": [
    {
      "id": "almalinux_9",
      "name": "AlmaLinux 9 Cloud",
      "catalog_group": "openstack_image_guide",
      "os_family": "almalinux",
      "os_version": "9",
      "login_user": "almalinux",
      "cloud_init": true,
      "cloudbase_init": false,
      "disk_formats": ["qcow2"],
      "container_format": "bare",
      "hypervisor_hints": ["kvm", "qemu"],
      "node_types": ["computer"],
      "roles": ["linux_host", "enterprise_linux"],
      "aliases": ["almalinux", "alma linux"],
      "legacy_ids": [],
      "default_flavor": {"vcpu": 2, "ram": 2048, "disk": 10},
      "maturity": "ga",
      "description": "Abstract AlmaLinux cloud image per OpenStack obtain-images.",
      "source_reference": "openstack://image-guide/obtain-images#almalinux"
    },
    {
      "id": "alpine_3",
      "name": "Alpine Linux Cloud",
      "catalog_group": "openstack_image_guide",
      "os_family": "alpine",
      "os_version": "3",
      "login_user": "alpine",
      "cloud_init": true,
      "cloudbase_init": false,
      "disk_formats": ["qcow2"],
      "container_format": "bare",
      "hypervisor_hints": ["kvm", "qemu"],
      "node_types": ["computer"],
      "roles": ["linux_host", "minimal"],
      "aliases": ["alpine", "alpine linux"],
      "legacy_ids": [],
      "default_flavor": {"vcpu": 1, "ram": 512, "disk": 5},
      "maturity": "ga",
      "description": "Abstract Alpine Linux cloud image.",
      "source_reference": "openstack://image-guide/obtain-images#alpine-linux"
    },
    {
      "id": "arch_linux",
      "name": "Arch Linux Cloud",
      "catalog_group": "openstack_image_guide",
      "os_family": "arch",
      "login_user": "arch",
      "cloud_init": true,
      "cloudbase_init": false,
      "disk_formats": ["qcow2"],
      "container_format": "bare",
      "hypervisor_hints": ["kvm", "qemu"],
      "node_types": ["computer"],
      "roles": ["linux_host", "rolling"],
      "aliases": ["arch", "archlinux"],
      "legacy_ids": [],
      "default_flavor": {"vcpu": 2, "ram": 2048, "disk": 10},
      "maturity": "ga",
      "description": "Abstract Arch Linux cloud image.",
      "source_reference": "openstack://image-guide/obtain-images#arch-linux"
    },
    {
      "id": "dragonflybsd",
      "name": "DragonFlyBSD Cloud",
      "catalog_group": "openstack_image_guide",
      "os_family": "dragonflybsd",
      "login_user": "root",
      "cloud_init": false,
      "cloudbase_init": false,
      "disk_formats": ["qcow2", "raw"],
      "container_format": "bare",
      "hypervisor_hints": ["kvm", "qemu"],
      "node_types": ["computer"],
      "roles": ["bsd_host"],
      "aliases": ["dragonfly", "dragonfly bsd"],
      "legacy_ids": [],
      "default_flavor": {"vcpu": 1, "ram": 1024, "disk": 10},
      "maturity": "ga",
      "description": "Abstract DragonFlyBSD cloud image.",
      "source_reference": "openstack://image-guide/obtain-images#bsd-dragonflybsd-freebsd-netbsd-openbsd"
    },
    {
      "id": "freebsd",
      "name": "FreeBSD Cloud",
      "catalog_group": "openstack_image_guide",
      "os_family": "freebsd",
      "login_user": "freebsd",
      "cloud_init": false,
      "cloudbase_init": false,
      "disk_formats": ["qcow2", "raw"],
      "container_format": "bare",
      "hypervisor_hints": ["kvm", "qemu"],
      "node_types": ["computer"],
      "roles": ["bsd_host"],
      "aliases": ["free bsd"],
      "legacy_ids": [],
      "default_flavor": {"vcpu": 2, "ram": 2048, "disk": 10},
      "maturity": "ga",
      "description": "Abstract FreeBSD cloud image.",
      "source_reference": "openstack://image-guide/obtain-images#bsd-dragonflybsd-freebsd-netbsd-openbsd"
    },
    {
      "id": "netbsd",
      "name": "NetBSD Cloud",
      "catalog_group": "openstack_image_guide",
      "os_family": "netbsd",
      "login_user": "netbsd",
      "cloud_init": false,
      "cloudbase_init": false,
      "disk_formats": ["qcow2", "raw"],
      "container_format": "bare",
      "hypervisor_hints": ["kvm", "qemu"],
      "node_types": ["computer"],
      "roles": ["bsd_host"],
      "aliases": ["net bsd"],
      "legacy_ids": [],
      "default_flavor": {"vcpu": 1, "ram": 1024, "disk": 10},
      "maturity": "ga",
      "description": "Abstract NetBSD cloud image.",
      "source_reference": "openstack://image-guide/obtain-images#bsd-dragonflybsd-freebsd-netbsd-openbsd"
    },
    {
      "id": "openbsd",
      "name": "OpenBSD Cloud",
      "catalog_group": "openstack_image_guide",
      "os_family": "openbsd",
      "login_user": "openbsd",
      "cloud_init": false,
      "cloudbase_init": false,
      "disk_formats": ["qcow2", "raw"],
      "container_format": "bare",
      "hypervisor_hints": ["kvm", "qemu"],
      "node_types": ["computer"],
      "roles": ["bsd_host"],
      "aliases": ["open bsd"],
      "legacy_ids": [],
      "default_flavor": {"vcpu": 1, "ram": 1024, "disk": 10},
      "maturity": "ga",
      "description": "Abstract OpenBSD cloud image.",
      "source_reference": "openstack://image-guide/obtain-images#bsd-dragonflybsd-freebsd-netbsd-openbsd"
    },
    {
      "id": "centos_stream_9",
      "name": "CentOS Stream 9 Cloud",
      "catalog_group": "openstack_image_guide",
      "os_family": "centos",
      "os_version": "9-stream",
      "login_user": "cloud-user",
      "cloud_init": true,
      "cloudbase_init": false,
      "disk_formats": ["qcow2"],
      "container_format": "bare",
      "hypervisor_hints": ["kvm", "qemu"],
      "node_types": ["computer"],
      "roles": ["linux_host", "enterprise_linux"],
      "aliases": ["centos", "centos stream", "centos 9"],
      "legacy_ids": [],
      "default_flavor": {"vcpu": 2, "ram": 2048, "disk": 10},
      "maturity": "ga",
      "description": "Abstract CentOS Stream 9 cloud image.",
      "source_reference": "openstack://image-guide/obtain-images#centos"
    },
    {
      "id": "centos_stream_10",
      "name": "CentOS Stream 10 Cloud",
      "catalog_group": "openstack_image_guide",
      "os_family": "centos",
      "os_version": "10-stream",
      "login_user": "cloud-user",
      "cloud_init": true,
      "cloudbase_init": false,
      "disk_formats": ["qcow2"],
      "container_format": "bare",
      "hypervisor_hints": ["kvm", "qemu"],
      "node_types": ["computer"],
      "roles": ["linux_host", "enterprise_linux"],
      "aliases": ["centos 10", "centos stream 10"],
      "legacy_ids": [],
      "default_flavor": {"vcpu": 2, "ram": 2048, "disk": 10},
      "maturity": "ga",
      "description": "Abstract CentOS Stream 10 cloud image.",
      "source_reference": "openstack://image-guide/obtain-images#centos"
    },
    {
      "id": "cirros",
      "name": "CirrOS 0.6.x (test)",
      "catalog_group": "openstack_image_guide",
      "os_family": "cirros",
      "os_version": "0.6",
      "login_user": "cirros",
      "cloud_init": true,
      "cloudbase_init": false,
      "disk_formats": ["qcow2"],
      "container_format": "bare",
      "hypervisor_hints": ["kvm", "qemu"],
      "node_types": ["computer"],
      "roles": ["test", "minimal", "smoke"],
      "aliases": ["cirros", "smoke test", "openstack test image"],
      "legacy_ids": [],
      "default_flavor": {"vcpu": 1, "ram": 256, "disk": 2},
      "maturity": "preview",
      "description": "Minimal OpenStack test image; not for public exposure in real clouds.",
      "source_reference": "openstack://image-guide/obtain-images#cirros-test"
    },
    {
      "id": "debian_12",
      "name": "Debian 12 Cloud",
      "catalog_group": "openstack_image_guide",
      "os_family": "debian",
      "os_version": "12",
      "login_user": "debian",
      "cloud_init": true,
      "cloudbase_init": false,
      "disk_formats": ["qcow2"],
      "container_format": "bare",
      "hypervisor_hints": ["kvm", "qemu"],
      "node_types": ["computer"],
      "roles": ["linux_host"],
      "aliases": ["debian"],
      "legacy_ids": [],
      "default_flavor": {"vcpu": 2, "ram": 2048, "disk": 10},
      "maturity": "ga",
      "description": "Abstract Debian cloud image.",
      "source_reference": "openstack://image-guide/obtain-images#debian"
    },
    {
      "id": "fedora_40",
      "name": "Fedora 40 Cloud",
      "catalog_group": "openstack_image_guide",
      "os_family": "fedora",
      "os_version": "40",
      "login_user": "fedora",
      "cloud_init": true,
      "cloudbase_init": false,
      "disk_formats": ["qcow2"],
      "container_format": "bare",
      "hypervisor_hints": ["kvm", "qemu"],
      "node_types": ["computer"],
      "roles": ["linux_host", "desktop_capable"],
      "aliases": ["fedora"],
      "legacy_ids": [],
      "default_flavor": {"vcpu": 2, "ram": 2048, "disk": 15},
      "maturity": "ga",
      "description": "Abstract Fedora cloud image.",
      "source_reference": "openstack://image-guide/obtain-images#fedora"
    },
    {
      "id": "kali_linux",
      "name": "Kali Linux Cloud",
      "catalog_group": "openstack_image_guide",
      "os_family": "kali",
      "login_user": "kali",
      "cloud_init": true,
      "cloudbase_init": false,
      "disk_formats": ["qcow2"],
      "container_format": "bare",
      "hypervisor_hints": ["kvm", "qemu"],
      "node_types": ["computer"],
      "roles": ["linux_host", "security", "pentest"],
      "aliases": ["kali"],
      "legacy_ids": [],
      "default_flavor": {"vcpu": 2, "ram": 4096, "disk": 25},
      "maturity": "ga",
      "description": "Abstract Kali Linux cloud image.",
      "source_reference": "openstack://image-guide/obtain-images#kali-linux"
    },
    {
      "id": "windows_server_2019",
      "name": "Windows Server 2019 (cloudbase-init)",
      "catalog_group": "openstack_image_guide",